{"schemaVersion":"1.0.0","id":"run","intent":{"schemaVersion":"1.0.0","id":"saas-launch","title":"Signal Foundry launch","scope":{"level":"page","surface":"launch"},"outcome":{"problem":"Visitors do not understand the product.","desiredChange":"Visitors understand, trust, and start a trial.","antiGoals":["generic template"]},"audiences":[{"id":"ops","label":"Ops lead","context":"evaluating software","needs":["clarity"]}],"tasks":{"primary":{"actorId":"ops","action":"start","object":"trial","completionSignal":"trial opens"},"secondary":[]},"brand":{"values":[{"name":"clarity","expression":"direct proof","avoid":"vague hype"}],"voice":["calm"],"distinctiveAssets":[],"referencePolicy":"original-only"},"experience":{"emotionalRegister":["calm"],"density":"moderate","familiarity":"familiar controls","motion":"optional","hierarchy":"one action then proof"},"success":{"criteria":[{"id":"trial","signal":"trial starts","direction":"increase","target":"baseline","weight":1}],"qualityProfile":{"weights":{"taskClarity":0.35,"accessibility":0.25,"distinctiveness":0.25,"maintainability":0.15},"floors":{"taskClarity":0.7,"accessibility":0.75,"distinctiveness":0.55,"maintainability":0.6},"uncertaintyPenalty":0.18}},"constraints":{"hard":[{"id":"keyboard","category":"a11y","statement":"Keyboard works.","verification":"test"}],"soft":[]},"freedoms":{"fixed":["copy"],"open":["composition"],"forbidden":["copied layout"]},"states":[{"id":"desktop-light","viewport":{"width":1440,"height":900},"colorScheme":"light","reducedMotion":false,"locale":"en-AU"},{"id":"mobile-light","viewport":{"width":390,"height":844},"colorScheme":"light","reducedMotion":false,"locale":"en-AU"},{"id":"desktop-dark","viewport":{"width":1440,"height":900},"colorScheme":"dark","reducedMotion":false,"locale":"en-AU"},{"id":"mobile-reduced","viewport":{"width":390,"height":844},"colorScheme":"dark","reducedMotion":true,"locale":"en-AU"}],"content":{"sourceOfTruth":"examples/saas-launch/content.json","missingPolicy":"fail","claimsRequireEvidence":true},"risks":[],"assumptions":[],"openQuestions":[]},"policy":{"selectionWeights":{"evidence":0.7,"pairwise":0.25,"diversity":0.05},"diversityFloor":0.2,"uncertaintyPenalty":0.18,"reviewMargin":0.05,"maxUncertainty":0.25,"hardGateSeverities":["blocker","major"]},"candidates":[{"manifest":{"schemaVersion":"1.0.0","id":"signal-foundry","intentId":"saas-launch","title":"signal-foundry","direction":{"thesis":"signal","axes":{"composition":"signal-c","typography":"signal-t","spatialRhythm":"signal-s","surface":"signal-s","imagery":"signal-i","interaction":"signal-i","voice":"signal-v"},"deliberateTradeoffs":["clarity"],"rejectedPatterns":["template"]},"tokens":{"s":"4"},"structure":{"pattern":"signal","sections":["hero"]},"decisions":[{"question":"trust","option":"proof","rationale":"intent","tradeoffs":["less art"]}],"changeContract":{"baselineRef":"main","allowedPaths":["signal-foundry/**"],"protectedPaths":["research/**"],"patchMode":"diff-only"},"supportedStates":["desktop-light","mobile-light","desktop-dark","mobile-reduced"]},"evidence":{"schemaVersion":"1.0.0","candidateId":"signal-foundry","captures":[{"browser":"chromium","stateRef":"desktop-light","url":"https://x/signal-foundry/desktop-light","viewport":{"width":1440,"height":900}},{"browser":"chromium","stateRef":"mobile-light","url":"https://x/signal-foundry/mobile-light","viewport":{"width":390,"height":844}},{"browser":"chromium","stateRef":"desktop-dark","url":"https://x/signal-foundry/desktop-dark","viewport":{"width":1440,"height":900}},{"browser":"chromium","stateRef":"mobile-reduced","url":"https://x/signal-foundry/mobile-reduced","viewport":{"width":390,"height":844}}],"signals":[{"id":"signal-foundry0","class":"B","dimension":"taskClarity","source":"fixture","status":"pass","normalized":0.95,"confidence":0.95,"severity":"note","stateRef":"desktop-light","nodeRef":"main","evidence":"observed","rationale":"intent","recommendation":"refine"},{"id":"signal-foundry1","class":"A","dimension":"accessibility","source":"fixture","status":"pass","normalized":0.95,"confidence":0.95,"severity":"note","stateRef":"desktop-light","nodeRef":"main","evidence":"observed","rationale":"intent","recommendation":"refine"},{"id":"signal-foundry2","class":"C","dimension":"distinctiveness","source":"fixture","status":"pass","normalized":0.9,"confidence":0.95,"severity":"note","stateRef":"desktop-light","nodeRef":"main","evidence":"observed","rationale":"intent","recommendation":"refine"},{"id":"signal-foundry3","class":"B","dimension":"maintainability","source":"fixture","status":"pass","normalized":0.9,"confidence":0.95,"severity":"note","stateRef":"desktop-light","nodeRef":"main","evidence":"observed","rationale":"intent","recommendation":"refine"}]}},{"manifest":{"schemaVersion":"1.0.0","id":"quiet-command","intentId":"saas-launch","title":"quiet-command","direction":{"thesis":"quiet","axes":{"composition":"quiet-c","typography":"quiet-t","spatialRhythm":"quiet-s","surface":"quiet-s","imagery":"quiet-i","interaction":"quiet-i","voice":"quiet-v"},"deliberateTradeoffs":["clarity"],"rejectedPatterns":["template"]},"tokens":{"s":"4"},"structure":{"pattern":"quiet","sections":["hero"]},"decisions":[{"question":"trust","option":"proof","rationale":"intent","tradeoffs":["less art"]}],"changeContract":{"baselineRef":"main","allowedPaths":["quiet-command/**"],"protectedPaths":["research/**"],"patchMode":"diff-only"},"supportedStates":["desktop-light","mobile-light","desktop-dark","mobile-reduced"]},"evidence":{"schemaVersion":"1.0.0","candidateId":"quiet-command","captures":[{"browser":"chromium","stateRef":"desktop-light","url":"https://x/quiet-command/desktop-light","viewport":{"width":1440,"height":900}},{"browser":"chromium","stateRef":"mobile-light","url":"https://x/quiet-command/mobile-light","viewport":{"width":390,"height":844}},{"browser":"chromium","stateRef":"desktop-dark","url":"https://x/quiet-command/desktop-dark","viewport":{"width":1440,"height":900}},{"browser":"chromium","stateRef":"mobile-reduced","url":"https://x/quiet-command/mobile-reduced","viewport":{"width":390,"height":844}}],"signals":[{"id":"quiet-command0","class":"B","dimension":"taskClarity","source":"fixture","status":"pass","normalized":0.78,"confidence":0.95,"severity":"note","stateRef":"desktop-light","nodeRef":"main","evidence":"observed","rationale":"intent","recommendation":"refine"},{"id":"quiet-command1","class":"A","dimension":"accessibility","source":"fixture","status":"pass","normalized":0.9,"confidence":0.95,"severity":"note","stateRef":"desktop-light","nodeRef":"main","evidence":"observed","rationale":"intent","recommendation":"refine"},{"id":"quiet-command2","class":"C","dimension":"distinctiveness","source":"fixture","status":"pass","normalized":0.62,"confidence":0.95,"severity":"note","stateRef":"desktop-light","nodeRef":"main","evidence":"observed","rationale":"intent","recommendation":"refine"},{"id":"quiet-command3","class":"B","dimension":"maintainability","source":"fixture","status":"pass","normalized":0.82,"confidence":0.95,"severity":"note","stateRef":"desktop-light","nodeRef":"main","evidence":"observed","rationale":"intent","recommendation":"refine"}]}},{"manifest":{"schemaVersion":"1.0.0","id":"kinetic-lab","intentId":"saas-launch","title":"kinetic-lab","direction":{"thesis":"kinetic","axes":{"composition":"kinetic-c","typography":"kinetic-t","spatialRhythm":"kinetic-s","surface":"kinetic-s","imagery":"kinetic-i","interaction":"kinetic-i","voice":"kinetic-v"},"deliberateTradeoffs":["clarity"],"rejectedPatterns":["template"]},"tokens":{"s":"4"},"structure":{"pattern":"kinetic","sections":["hero"]},"decisions":[{"question":"trust","option":"proof","rationale":"intent","tradeoffs":["less art"]}],"changeContract":{"baselineRef":"main","allowedPaths":["kinetic-lab/**"],"protectedPaths":["research/**"],"patchMode":"diff-only"},"supportedStates":["desktop-light","mobile-light","desktop-dark","mobile-reduced"]},"evidence":{"schemaVersion":"1.0.0","candidateId":"kinetic-lab","captures":[{"browser":"chromium","stateRef":"desktop-light","url":"https://x/kinetic-lab/desktop-light","viewport":{"width":1440,"height":900}},{"browser":"chromium","stateRef":"mobile-light","url":"https://x/kinetic-lab/mobile-light","viewport":{"width":390,"height":844}},{"browser":"chromium","stateRef":"desktop-dark","url":"https://x/kinetic-lab/desktop-dark","viewport":{"width":1440,"height":900}},{"browser":"chromium","stateRef":"mobile-reduced","url":"https://x/kinetic-lab/mobile-reduced","viewport":{"width":390,"height":844}}],"signals":[{"id":"kinetic-lab0","class":"A","dimension":"taskClarity","source":"fixture","status":"fail","normalized":0.3,"confidence":0.95,"severity":"major","stateRef":"desktop-light","nodeRef":"main","evidence":"observed","rationale":"intent","recommendation":"refine"},{"id":"kinetic-lab1","class":"A","dimension":"accessibility","source":"fixture","status":"fail","normalized":0.3,"confidence":0.95,"severity":"blocker","stateRef":"desktop-light","nodeRef":"main","evidence":"observed","rationale":"intent","recommendation":"refine"},{"id":"kinetic-lab2","class":"C","dimension":"distinctiveness","source":"fixture","status":"pass","normalized":0.95,"confidence":0.95,"severity":"note","stateRef":"desktop-light","nodeRef":"main","evidence":"observed","rationale":"intent","recommendation":"refine"},{"id":"kinetic-lab3","class":"B","dimension":"maintainability","source":"fixture","status":"pass","normalized":0.42,"confidence":0.95,"severity":"note","stateRef":"desktop-light","nodeRef":"main","evidence":"observed","rationale":"intent","recommendation":"refine"}]}}],"pairwise":[{"left":"signal-foundry","right":"quiet-command","winner":"signal-foundry","confidence":0.9,"rationale":"clearer"},{"left":"signal-foundry","right":"kinetic-lab","winner":"signal-foundry","confidence":0.97,"rationale":"safe"},{"left":"quiet-command","right":"kinetic-lab","winner":"quiet-command","confidence":0.95,"